,Name,style,IBU,ABV,Description
655,Belle,Devil's Canyon Brewing Co.,10,6.0,"Belle, a Champagne style Sparkling Ale, is a true feast for your senses with its rich, straw-like appearance and aromatic, fruity nose. This celebratory beer has a crisp, sweet flavor with a strong, dry, effervescent finish. Read Less"
656,Freckled Rooster,Finnegans Brew Co.,18,5.8,Bière de Champagne /
657,Samuel Adams Sparkling Ale,Boston Beer Company,20,4.8,Bière de Champagne /
658,Yin & Yang,Evil Twin Brewing,100,10.0,"This is a complete RTD Black and Tan. Not just any Black and Tan but the one where we flawlessly mixed a flippant good Imperial IPA with a profoundly evil Imperial Stout and sustained sweet beer balance.

33% Stout and 67% India Pale Al"
659,Black & Tan,Breakside Brewery,19,8.4,"Our take on this age-old idea veers into some uncharted territory by using BOURBON BARREL-AGED STOUT as the ‘black’ component. The ‘tan’ is made from young golden beer and some Bourbon barrel-aged Scottish ale. The 40/60 blend of aged and young beer pops with flavor, yet manages to stay easy drinking"
661,When Krakens Attack,Tackle Box Brewing Company,45,8.5,What do you get when you blend our ultra popular Money Lure Blueberry Ale and our Baltic Sea Monster? A beer that will sink
662,Black & Tan (Coalminer's Stout & Vanilla Cream Ale),Blackhorse Brewery,33,5.5,A blend between our Coalminer's Stout and Vanilla
665,Black & Tan,McClellan's Brewing Company,35,6.0,A blend of our Irish Ale and our oatmeal porter that beautifully highlights the roasted coffee and caramel notes of each beer. Kind of like drinking a mocha but a lot more fun
670,Joe & Dan's Black & Tan,Oakbrook Brewing Company,48,7.0,Oakbrook's Blend of Double Pale Ale & American Stout yields a deceptively easy drinking treat with notes of caramel candy and bittersweet chocolate
672,JP-8,Folklore Brewing & Meadery,50,7.5,A blend of our Shadowcaster Porter and Snipe Hunt IPA fermented together to create a rich malt-chocolate 
674,Shabadoo Black and Tan Ale,Berkshire Brewing Company (B.B.C.),27,6.3,"A decision for the indecisive, “Shabadoo” is a delicate blend of
our Hoosac Tunnel Amber Ale and Drayman’s Porter.
Showcasing elements of each, this full-bodied dark brew
combines the caramel malt and hop profile of an Amber with
the chocolate and mocha notes of the Porter, making for a
sublime concoction with broad appeal"
675,Bodacious Black and Tan,Hoppin' Frog Brewery,65,7.8,"IPA and Stout converge for a really great flavor combination! The assertive, hoppy character of our Hoppin' To Heaven IPA is perfectly complimented by the intense, deep roasted taste of our B.O.R.I.S. Oatmeal-Imperial Stout"
676,Devil Strip,Hoppin' Frog Brewery,41,6.85,"Hoppy IPA combined with our chocolate Porter, to celebrate the best of art and culture. The perfect combination of these two elements captures the best of both worlds. It can be bigger than the sum, creating the very best experiences that life has to offer.

I’m our neck of the woods, the tree lawn is revered to as the devil strip. The devil is in the details"
680,Harpoon 100 Barrel Series #45: Directors' Cut,Harpoon Brewery,38,6.25,"Mark Edwards and Jim Perry (members of Harpoon's Board of Directors) knew that being lifelong friends with Harpoon's co-founders, Rich and Dan, would eventually pay off. This 100 Barrel Series beer is proof of that! After being unable to settle on one particular style, Mark and Jim thought it would be fun to try blending two of their favorite styles – pale ale and stout. Friendship is like brewing… always a creative collaboration.

This complex, yet drinkable beer is a blend of pale ale and stout. The aroma is a combination of hop from the pale ale with roasted notes and just a hint of smoke from the stout. The rounded body of the beer starts with sweetness from the caramel malt in the pale ale and finishes with aggressive roasted fullness of the stout. The finish is crisp and bitter, but with no astringency. This perfectly blended beer is the marriage of two excellent individual beers coming together to make one phenomenal brew. Read Less"
682,Midnight Flinke,Nimble Hill Brewing,20,5.5,"This is a blend of 70% Flinke Hügel lager and 30% of our Midnight Fuggle porter. When you just can’t decide which to have,"
683,Black And Tan,Thimble Island Brewing Company,33,5.5,"Delicious! When we first opened our brewery tasting room we only had 2 styles of beer to offer, American ale and Coffee stout. One of our early tasting room regulars, Max, began blending the twe together to make a black and tan which quickly became a favorite. The continued popularity of this blend inspired us t combine the best elements of both beers into a unique recipe of its own. Black and tan balances the sweet malts of an ale with the rich dark tones of a stout creating a harmoniously complex and drinkable brew"
684,Scorched Coffee India Pale Ale,Burning Brothers Brewing,48,6.7,"I like coffee and I like IPAs. If only there was a way that I could have both at the same time... Now I can! Scorched is our version of a black and tan, giving you the kick of cold press coffee and the punch of a hop forward IPA"
690,Black & Tan,Yuengling Brewery,12,4.6,"Yuengling Black & Tan models a traditional English Half & Half. Introduced in 1986, Yuengling produced one of the first hand-crafted draft blends to lead this style of American brewing. Black & Tan combines 60% of our popular Dark Brewed Porter and 40% of our Premium Beer to create a brew that is rich and dark in color with hints of caramel and coffee from the dark roasted malts.

Learn more: http://www.yuengling.com/black_and_ta"
698,Key Lime Slice,Playalinda Brewing Company,13,5.0,Wedge of the south 
700,Walden,Hill Farmstead Brewery,40,4.0,"A sessionable blonde ale. 4% abv. 40 IBUs. Hopped with Motueka, Amarillo "
702,Quinntiki,Avery Brewing Co.,35,16.2,"Barrel aged imperial blonde ale aged in rum barrels with pineapple, coconut, orange, "
703,Vanilla Skies,Martin House Brewing Company,28,12.0,Whiskey Barrel-Aged Imperial Blonde Ale with Va
704,Good Morning Vietnam,Wooden Robot Brewery,40,5.0,"Coffee Vanilla Blonde
Made with locally roasted Ethiopian Coffee from our friends at Enderly Coffee Roasters and rich Madagascar Vanilla Beans. The result is a unique beer that is both approachable and complex"
706,Blonde Roast,Bond Brothers Beer Company,20,6.0,blonde ale with coffee from Black & White Coffe
709,Churro Coffee Table,MadTree Brewing Company,16,4.7,"Blonde Ale with Deeper Roots coffee, lactose, cinnamon, vanilla, "
714,Libby (w/ Galaxy),Tilted Barn Brewery,40,5.0,"Dry hopped with Galaxy, this version is full of those tropical fruit flavo"
716,The Bean,Swan Brewing,15,5.5,Our coconut cof
728,Evening Joe Caramel Macchiato Coffee Blonde,Catawba Brewing Co.,25,5.7,"This specialty variant on our signature Coffee Blonde takes everything you love about Evening Joe and enhances it with a swirl of luscious salted caramel. Natural vanilla flavor and lactose sugar add a hint of sweet cream to top off this macchiato-inspired cold brew. Looks like your evening pint, but drinks like your morning cup. Here’s to ending your day as deliciously as it began — now for caramel lovers!

**Contains lactose*"
730,Coffee Table,MadTree Brewing Company,23,4.7,Coffee blonde ale with Deeper Roots coffee beans and lac
738,Three Hour Tour,Lower Left Brewing Co.,14,5.2,"Blonde Ale with toasted organic coconut, vanilla and a special blend of malts. Like liquid Coconut Cream Pie, a tropical escape "
739,Thesis Pieces,Thesis Beer Project,20,5.4,Blonde ale with peanut butte. Conta
744,Samuel Adams Utopias Aged On Cherries,Boston Beer Company,25,28.0,Bock -
747,Bourbon Barrel-Aged Troegenator,Tröegs Independent Brewing,25,10.8,Bock -
748,Bourbon Barrel German Chocolate Cake,Lickinghole Creek Craft Brewery,21,10.0,Bock -
754,Złotonator,Goldfinger Brewing Company,20,7.2,Bock -
767,The Bock Hog,Harpoon Brewery,21,9.0,Bock -
768,Maple Bourbon Barrel Aged Abominator,Warped Wing Brewery,31,10.1,Bock -
771,Decapitator 2019,Buoy Beer Company,34,10.3,Bock -
773,Afternoon Delight,Sun King Brewery,23,10.2,Bock -
774,Bourbon Aged Dominator Doppelbock,O'so Brewing Company,20,10.5,Bock -
779,Whiskey Barrel Aged Doppelbock,Prost Brewing Co. & Biergarten,20,12.0,Bock -
782,Balinator,Carton Brewing Company,8,8.0,Bock -
783,Secale,Red Rock Brewing Co.,22,8.5,Bock -
786,Dunkelbock,KC Bier Co.,25,10.0,Bock -
788,20° of Nowhere,Barrique Brewing and Blending,18,9.1,Bock -
791,Double Oak Wuüddator,New England Brewing Co.,20,9.2,Bock -
793,Confectionator,Cigar City Brewing,46,13.5,Rum Barrel-aged Dopplebock with Coconut a
799,30th Anniversary Bourbon Barrel-Aged Eisbock,Lakefront Brewery,25,11.16,Boc
803,School of Bock,Rabbit Hole Brewing,30,13.5,"School of Bock is an intensely rich, malty German lager with a smooth, sweet finish and a significant alcohol punch. Munich malt character dominates the flavor and aroma, with minimal hop presence. Read Less"
804,Schnee Boot,Heavy Seas Beer,25,13.0,Boc
805,König Eisbock,KC Bier Co.,39,10.7,Boc
809,Smooth Like Jazz,Revelry Brewing,10,14.0,Boc
810,Eisbock (Buffalo Trace Barrels),Glacier Brewhouse,35,9.1,Boc
822,Otzi Eisbock,Fat Head's Brewery,30,9.5,Boc
825,Small Batch Eisbock,Catawba Brewing Co.,30,8.6,Boc
826,Eis Nine (Small Batch),Sun King Brewery,28,9.2,Boc
827,Eissturm,MobCraft Beer,40,9.0,Boc
830,FREEZE RAY EISBOCK,Strangeways Brewing,29,10.24,Boc
831,Fire & Eisbock,Mammoth Brewing Company,27,10.0,Boc
835,C-Bock,Midnight Sun Brewing Co.,26,9.5,Dark strong eisbock. In celebration of Anchorage's 100th anniversary. Available for a limited time on draft and gro
838,Rum-Tum-Tumbly,Burnside Brewing Co.,32,9.6,"This is a strong, full-bodied malty beer brewed in the Bock tradition. The brewery chilled the bright tanks to below freezing for a number days to create an ""icy"" atmosphere prior to cold aging in spiced rum barrels for three weeks. This lager-fermented treat will warm your tummy during the cold winter months. Read Less"
839,Bulldog Bock,Alamo Beer Company,14,4.9,"Copper pour, to"
840,Maibock,Goldfinger Brewing Company,23,6.3,Bock - Hell / Maibock 
844,Dead 'N' Dead,Rogue Ales,40,7.9,Dead Guy Whiskey barrel-aged Dead Guy Ale. A deep copper maibock-style ale with notes of whisk
845,Maibock,Dovetail Brewery,30,6.3,Bock - Hell / Maibock 
846,1516,Red Oak Brewery,22,7.0,Bock - Hell / Maibock 
851,Prevernal Love,Wild East Brewing Co.,22,7.0,Bock - Hell / Maibock 
853,Mai-o-maibock,KC Bier Co.,25,10.0,Amber doppe
854,Updraft Anniversary Maibock,Ghost Hawk Brewing Company,10,7.7,Bock - Hell / Maibock 
857,Goat Destroyer,Old Irving Brewing Co.,26,7.0,Bock - Hell / Maibock 
859,Bock Sabbath,Blue Stallion Brewing Co.,27,6.66,Bock - Hell / Maibock 
860,Skool House Bock,Moontown Brewing Co.,25,7.5,Bock - Hell / Maibock 
862,Clovenbock,Wayfinder Beer,25,6.9,Bock - Hell / Maibock 
863,Peanut Butter Fudge Puff,Platform Beer Company,28,7.1,Bock - Hell / Maibock 
865,Maibock,Chuckanut Brewery,25,7.0,Bock - Hell / Maibock 
867,The Maibuck,Wallenpaupack Brewing Company,28,7.0,Bock - Hell / Maibock 
868,Maibock,NoDa Brewing Company,30,7.15,Bock - Hell / Maibock 
874,Rye In Mai Bock Yard,Friendship Brewing Company,26,8.0,"Nice German influence, begins with a wonderful malty aroma with dry flavor notes of carmel, toffee and a hint of nuttin"
876,Rolling Thunder Barrel-Aged XS Dead Guy Ale,Rogue Ales,60,9.0,Aged 10 months in Dead Guy Whiskey Barrels crafted at the Rolling Thunder Barrel Works cooperage
877,Cryptic Hymns,Burial Beer Co.,25,6.9,Foudre-A
878,Deliverance From the Other Side,Burial Beer Co.,30,6.9,Bock - Hell / Maibock 
879,Maibock Springtime Lagerbier,Haw River Farmhouse Ales,12,7.3,Bock - Hell / Maibock 
880,Rite of Spring,Combustion Brewery & Taproom,20,7.1,"Malty, lightly sweet with a dry finish that makes yo"
881,Maibock,HooDoo Brewing Co.,25,7.0,Bock - Hell / Maibock 
882,Town Musicians,Off Color Brewing,28,6.5,Bock - Hell / Maibock 
883,Lenzbock,Heater Allen Brewing,35,6.75,Bock - Hell / Maibock 
886,Glory Is Goldenbock,Burial Beer Co.,30,6.0,Bock - Hell / Maibock 
898,Bow-Chicka-Wow-Wow,Millstream Brewing,23,6.0,Bock - Single / 
902,Poop Your Pants,Perrin Brewing Co.,30,6.0,Bock - Single / 
903,Imperial Poop Your Pants,Perrin Brewing Co.,54,8.0,Bock - Single / 
904,Stagger Bock,Bonesaw Brewing Co,21,6.8,Bock - Single / 
907,Seipp's Columbia,The Conrad Seipp Brewing Co.,25,6.0,Bock - Single / 
911,There And Bock Again,Obscure Brewing Co.,21,6.5,Complex malty richness with some toasted caramel notes. Smooth mouthfeel with a cl
913,Holiday Bock,Dovetail Brewery,30,6.1,This beer is brewed for merrymaking. It's 100% barley malt lager with reddish tones from the generous addition of ca
916,Bock Betty,Friendship Brewing Company,28,5.0,This is our take on a German dark lager. Notes of roasty malt and caramelized sugars come through on this very dri
918,Monopolist,Calusa Brewing,40,6.8,Bock - Single / 
920,Reserve Trippelbock,Wagner Valley Brewing Company,17,10.0,Bock - Single / 
921,Douze - Bourbon Barrel Bock,Port Orleans Brewing Co.,24,9.0,Bock - Single / 
922,Baphomet,Revolution Brewing Company,30,6.66,"Baphomet Bock is a powerful adversary brought forth from traditional German ingredients and a long, cool fermentation time"
923,Frankville Bourbon Bock,PIVO Brewery,28,8.8,"Rich, oaky. Notes of vanilla, caramel, toffee, & coffee. Bock aged in bourbon barrels "
924,Exterior Illumination,Deviant Wolfe Brewing,22,6.7,Bock - Single / 
926,Pumpkin Pie Cream Ale,JAKs Brewing Company,13,5.5,Bock - Single / 
929,Krampus Nacht,The Black Abbey Brewing Company,20,7.0,Bock - Single / 
931,Prince Haakon Honey Bock,Earth Rider Brewery,21,7.0,Bock - Single / 
932,Bock,Daredevil Brewing Co,25,7.2,"A smooth, easy drinking German lager that emphasizes malty, toasty, rich aromas and flav"
934,Little Bock of Calm,Shovel Town Brewery,23,6.6,An award winning German-style lager - dark amber in color with a robust and balanced malt profile. Brewed with all imported German mal
936,Battlefield,Red Oak Brewery,28,6.5,Bock - Single / 
937,Ammo Bocks,Bear Island Brewing Co.,27,6.3,Bock - Single / 
938,Penalty Bocks,District 1 Brewing Company,22,6.9,Bock - Single / 
942,De Kleine Dood,Central Waters Brewing Company,12,12.2,"De Kleine Dood (formerly known as La Petite Mort) is a Belgian inspired Weizenbock brewed as a collaboration between Central Waters and The Local Option in Chicago, IL. This beer maintains the traditional characteristics of its Bavarian fore bearer, with the added complexity of Belgian ale yeast. La Petite Mort is dark amber in color; maintains a rich, full-bodied mouth-feel augmented by caramel; mild and dark fruit. Read Less"
948,The Fat King,Loaded Dice Brewery,27,8.7,Bock -
950,Tannhauser Gate,Cigar City Brewing,31,11.0,Bock -
951,COLOSSAL® IX,Port City Brewing,15,8.0,"To celebrate nine years of brewing we created Colossal® IX in 2020, a German-style Weizenbock – a style fusing characteristics of a wheat and bock beer. Mahogany in color, this malt forward beer boasts a bouquet of ripe banana, clove, and dark fruit capped off with a billowing beige head. The flavor is rich, with a bit of dark fruit, and the finish is creamy and satisfying. Read Less"
958,Word To the Weizenbock,Bosacki's Brewery,21,8.3,Bock -
960,The Fox and the Stork,Mad Fritz,25,7.5,Bock -
962,Weizenbock,Riggs Beer Company,14,7.3,Bock -
963,CaroBock,Dogfish Head Craft Brewery,25,8.0,"Bavarian-style strong, dark wheat beer aged with Carob pods and Madagascar va"
964,Doppeldunkelweizenbock,Rentsch Brewery,25,9.0,Bock -
967,Alpenglow,Fat Head's Brewery,20,8.5,Bock -
