,Name,style,IBU,ABV,Description
789,Disco Ninja,IPA - New England / Hazy,40,7.0,"It’s a simple universal fact that ninjas are badass. You know what else is badass? Revision beer. Our buddies at Shoe Tree Brewing kicked around ideas with us to develop this tasty, tantalizing, karate chop in your freaking mouth. Kaleidoscopic nunchuck hits to the dome with Citra, Galaxy, Mosaic and Amarillo. Stealthily slaying your taste buds, one sip at a time"
790,Revision IPA,IPA - American,50,6.5,"Low impact bitterness, high impact aroma and flavor. Simcoe lays the hop foundation for this extremely delicious, flavorful and quaffable American India Pale Ale. Tropical citrus, orange and pine flavors meld seamlessly"
791,Dr. Lupulin 3x,IPA - Triple,133,11.3,"The art and science of awesome. Somewhat of an anomaly, Doctor Lupulin is brewed with loads of hops but is not too bitter. A high ABV brew that is easy drinking without excessive alcohol heat. Is that mango having a pleasant conversation with dank? Yep. The experiment to create beer perfection is alive"
792,Reno As Fuck,IPA - Imperial / Double New England / Hazy,23,8.4,"Imperial NE-Style IPA with Simcoe, Mosaic and Citra hops. Embracing the no-holds-barred, pure, dirty, clean, crass culture of the greatest place in the world, this beer is a reflection of the city it was born in. It's real, down-to-earth and unfiltered. You don't buy this beer, you earn this beer. This beer is Reno as Fuck"
793,DIPA,IPA - Imperial / Double,75,8.0,"This Double India Pale Ale is late-hopped with Simcoe® and Mosaic® hops, creating massive citrus and pine aroma with resiny notes of orange, tangelo, and peach"
794,Smoke and Mirrors,IPA - Imperial / Double New England / Hazy,30,8.0,"Citra, Mosaic, and Amarillo hops form a power trio of tastiness in this double dose of liquid goodness. No illusions here, see with your mind and flavor and aroma receptors what’s really going on. The answer is stoke"
795,Glitter Moon,IPA - Imperial / Double New England / Hazy,40,8.5,The bulk of the hop aroma and flavor in this brew come from the land down under. Galaxy and Vic Secret hops from Australia exude pineapple and passionfruit goodness while a solid chunk of oats in the grain bill makes for a smooth mouthfeel
796,Sparkle Muffin,IPA - New England / Hazy,30,7.0,"This fruit-forward single IPA features deep flavors of citrus from the hops yet is easy drinking. Don't wait until later, enjoy right meow!"
797,Social Fermentation,IPA - New England / Hazy,35,6.5,"It’s fun to party with your friends. The gang’s all here in this highly drinkable Northeast IPA. Citra and Mosaic of course, and our buddy Amarillo, life of the party Galaxy and recent addition to the squad Vic Secret. Hang out, drink up, and party on"
798,Hazy Life,IPA - Imperial / Double New England / Hazy,42,7.75,"This is the good life, full of friends, great experiences, and super tasty haze. Highlighting Mosaic and Cashmere hops, this brew delivers notes of passionfruit, peach, lemon, and guava over a supah smoove malt base"
799,Planet Lovetron,IPA - New England / Hazy,25,6.5,"Hitch a free ride onboard the Mothership Connection to Planet Lovetron. Ease your mind and soul with bright citrus and stonefruit flavors of Amarillo, Mosaic and Citra hops, floating on a pillowy bed of malted goodness. You might love these hops, but they love you back even more. Soak in the positive vibes and exercise your posifunkentronic membranes while digging your place in the universe, tasty beer in hand"
800,Citra Slam,IPA - American,50,6.5,"Creating a flavor crater of awesomeness, this West Coast IPA hopped exclusively with the one and only Citra hop is built for enjoyment. Tropically sweet hop flavors and aromas bring to mind ripe tangerine with an edge of passionfruit. Go ahead and crush it, gulp it, guzzle it, slam it"
801,Battle of the Lords,IPA - Imperial / Double New England / Hazy,45,8.5,"To become your best self you may need to vanquish your old self. You look at your reflection in the mirror, smash the mirror and walk forward.

A hefty yet light on its feet double hazy IPA, Battle of the Lords will slay ya with flavah and crush yer aromatic senses with a definitive hop punch. Galaxy and Vic Secret provide a one-two combo with notes of passionfruit, pineapple, orange and lime"
802,Tahoe Haze,IPA - New England / Hazy,30,6.5,66.66% Citra and 33.33% Mosaic hops. Waves of orange and tangerine flavor hit the lake shore like sweet nectar. Dive in.
803,The Bruff,IPA - Imperial / Double New England / Hazy,35,8.0,"We found an old mechanical hop picking machine in the fields of England, in the shadow of Stonehenge. With a lot of work, a modicum of sweat and a little monkey grease, the newly refurbished machine has been repurposed to deliver hop flavor to your mouth as efficiently as possible.

Featuring a heap of citrusy Citra and mounds of mango-ish Mosaic hops conveyor belted on a base of wheat and flaked oats"
804,What What,IPA - Imperial / Double,85,9.1,"Can I get a What What? What? Yep, you heard right. A collection of C hops and a dash of Equinox create waves of hop flavor and perhaps a bit of a smackdown over a lightly sweet malt backbone. Sniff. Sip. Sniff. Sip. Sniff. Sip. Dang, all gone. What I say"
805,Hops In A Can,IPA - Triple New England / Hazy,75,10.5,"NE-Style Hazy Triple IPA.

Pop a top off a can of hops, the waft of aromatic intensity is inevitable. Citra, Simcoe, Amarillo and Mosaic hops deliver sticky, resiny, sweet citrusy hop flavor. Our hazy hoppy beers taken up a notch. Set 'em up my friends"
806,Pour Decisions,IPA - Triple New England / Hazy,67,11.0,"It's late. Probably close to 3:00 AM, but your phone is for making questionable calls and looking at funny videos, not for checking time. Yeah, one more sounds like a good idea. Maybe even a GREAT idea. And whoa, you're a unicorn. Brewing this beer with Mosaic, Vic Secret, and Amarillo was a good decision"
807,Lord Lupulin,IPA - New England / Hazy,32,6.5,"Introducing the high priest of hops , the hero of humulus lupulus, the sultan of strig, the brahma of bracteole…Here comes Lord Lupulin! Featuring our hoppy friends Galaxy, Vic Secret, El Dorado and Citra"
808,Leafy Greens,IPA - American,55,7.25,"Dig the dank. Savor the stank. Leafy Greens presents an increase by orders of magnitude in dankness. The aroma of certain hops, particularly CTZ, has long been described as similar to marijuana. Scientific examination has indeed proven that Humulus Lupulus and Cannabis Sativa are relatives, both members of the Cannabinaceae family. Ponder these branches of the family tree while enjoying this mellow IPA with friends, music, solid visuals and readily available munchies."
809,Mindful Fermentation,IPA - Imperial / Double New England / Hazy,36,8.5,"We think about beer, a lot. Synapses firing, thoughts bubbling, ideas percolating in an ever-evolving quest to make somethin' super tasty. This beer was brewed with Citra, Simcoe, and a bit of milk sugar. We hope you enjoy our latest liquid thought"
810,Distance Haze,IPA - Imperial / Double New England / Hazy,40,8.0,"Yea, though I walk through the valley of the shadow of dank, I will fear no haze, for hops art with me. Thy flavor and thy aroma, they comfort me. A vision in the distance; an orange groove? A hop farm? It sure smells good. Saints and sinners are all welcome to this soul shakedown party"
811,Staff of Life,IPA - Imperial / Double New England / Hazy,38,8.0,"We all need a little help on the way, some support while briefly traveling through this world. More than a walking stick, the Staff of Life lifts your spirits with a blend of Mosaic, Equinox and CTZ over a pillowy malt base. Smooth yet packed full of hop flavah and aroma, this is the refreshing beverage to quaff on the journey to the promised land"
812,Playafication,IPA - New England / Hazy,42,6.0,"Out there. Art festival? Self-expression fully realized? Dance party? Giving/sharing economy? Blinky light madness? Alkaline dust-covered humorous mayhem? Yes and no. Bring all you will need but less than you think, and save a cooler for cans of Playafication. A thirst-quenching. Refreshing Northest-Style IPA born of 100% Mosaic hops"
813,Planetary Fog,IPA - Imperial / Double New England / Hazy,23,7.5,"(Double IPA - NE Style)

A big bang of Amarillo, Mosaic, Citra, and Galaxy hops in every vessel. This beer’s gravitational force thrusts pizza and beer lovers around the Northeastern dimension and straight into a Planetary Fog. Cheers"
814,Mystic Mama,IPA - American,80,7.0,"Our West-Coast inspired India Pale ale offers lots of flavor and aroma without over-powering the senses. A complex blend of 5 hops lend a firm bitterness to the notes of grapefruit, tangerines, and pine. A big dry hop addition of Citra and Simcoe hops give Mystic Mama a nose to stand up to the flavor"
816,Chomolungma,Brown Ale - American,33,6.5,"This brown ale was brewed to commemorate the 2007 Lungevity Everest Expedition. The people of Tibet call Mt. Everest “Chomolungma,” and this exceptional ale carries on the spirit of the climb. Seven Malts, three hops, and 100 pounds of local wild flower honey give this ale an exceptional character. Baked muffins, dark fruit, bittersweet chocolate, rich honey and earthy subtle hops caress the palate"
819,Oil of Aphrodite,Stout - Imperial / Double,41,10.0,"Oil of Aphrodite is an American double stout brewed with locally harvested black walnuts and Belgian candied syrup. English, German, American, and Belgian malts are accompanied by Pacific Northwest hops, creating a sweet and rich springboard for deep nuttiness"
821,Oro Negro,Stout - Imperial / Double,65,10.0,"Oro Negro is a dynamic beer brimming with layers of complexity and character; our cherished Oil of Aphrodite infused with cacao nibs, vanilla beans, oak staves, habaneros, and cinnamon sticks. A staple at our bottle releases. This refined stout is filled with rich character and a touch of heat"
825,Vanilla Coffee Bourbon Barrel Dark Apparition,Stout - Russian Imperial,30,11.3,"Seven malts were used to create deep flavors of coffee, chocolate, caramel, and molasses. A hint of bitterness and herbal character from carefully selected European and American hops help support the monolithic maltiness. This special batch was aged in bourbon barrels and conditioned on vanilla beans and whole coffee beans. A truly decadent brew that is intended to be poured into your favorite snifter and given time to warm up from its dark and cool resting place"
827,Bourbon Barrel Oil of Aphrodite,Stout - Imperial / Double,65,12.1,"Oil of Aphrodite is an American double stout brewed with locally harvested black walnuts and Belgian candied syrup. English, German, American, and Belgian malts are accompanied by Pacific Northwest hops, creating a sweet and rich springboard for deep nuttiness. Aged in Bourbon Barrels for 8 to 12 months"
833,Mandala Citra,IPA - Imperial / Double,110,9.0,"Designed to highlight single hop varietals, this Mandala features Citra hops. Citra exudes notes of mango, orange sherbert, and peach. The flavor follows suit as your pallet is covered in a sweet resinous wash"
837,Wood Ya Honey,Wheat Beer - Wheat Wine,70,13.0,"Wood Ya Honey is a wheat wine style ale brewed with generous amounts of local wild flower honey. After aging in bourbon barrels for one year, this beer emerges with the decadent character of dripping honey comb, marzipan, and raisin"
839,Gose,Sour - Traditional Gose,5,4.0,"Our interpretation of the traditional German-style sour wheat beer, brewed with coriander and grey sea salt. Sour, salty, delicious."
840,IPA,IPA - American,35,6.8,"Our flagship American IPA. Hopped with Amarillo, Centennial, Cascade, and Simcoe."
841,Mexican Cake,Stout - Imperial / Double,25,10.5,"Imperial stout w/ cocoa nibs, vanilla beans, cinnamon, and habanero peppers."
842,One Claw,Pale Ale - American,30,5.5,Zesty and tropical pale ale brewed with a touch of malted rye and Citra hops.
843,Key Lime Pie Gose,Sour - Fruited Gose,10,4.0,Our classic Gose infused with the delicious flavors of key lime pie.
844,White Thai,Wheat Beer - Witbier / Blanche,16,5.0,Southeast-Asian inspired witbier lightly spiced with ginger and lemongrass.
845,Two Claw,IPA - New England / Hazy,30,7.0,"Juicy IPA hopped with Citra, Azacca, and El Dorado."
846,Dark Helmet,Schwarzbier,20,6.0,German-style black lager with a ludicrously smooth roastiness.
847,Three Claw,IPA - Imperial / Double New England / Hazy,25,8.5,"Hazy NE-style double IPA dry hopped with over 5 lbs/bbl of Azacca, El Dorado, and Citra."
848,Lemon Cucumber Gose,Sour - Fruited Gose,5,4.0,Our classic Gose infused with lemon and cucumber. Zesty and refreshing.
849,Siberian Black Magic Panther,Stout - Imperial / Double,30,12.0,This beer is as hairy as a Siberian... or as a panther. And you better believe it because it gets the black magic from mountains of roasted malts and dark candi syrup. During the long weeks in the fermentor it gathers its rage... a rage this mythical beast of an imperial stout wants to unleash on your taste buds
851,Citrus Redacted,IPA - Imperial / Double,35,8.5,A sneaky double IPA brewed with tangerine and dry-hopped with 6 lbs/bbl of juicy hops. Prominent notes of orange & tangerine supported by layers of tropical fruit and pine
852,8th Anniversary Pecan Cookie Stout,Stout - Imperial / Double,20,9.0,"Imperial stout with pecans, winter spices and vanilla."
853,Zoose Joose,Sour - Fruited,5,4.0,"Ambrosia inspired sour ale with tangerine, pineapple, cherry, coconut, lactose and marshmallows. Collaboration with Angry Chair Brewing."
854,Rinse/Repeat Motueka Wakatu Double Dry Hopped,IPA - New England / Hazy,25,7.0,Hazy NEIPA double dry hopped with Motueka and Wakatu.
855,It's Tiki Time!,Sour - Fruited,5,5.0,"Get your freaky tiki on with this tropical spiced pineapple, passionfruit, and guava smoothie sour. IT IS TIME TO TIKI."
856,Rinse/Repeat Amarillo Citra El Dorado,IPA - New England / Hazy,25,7.0,"Hazy NEIPA hopped with Amarillo, Citra, and El Dorado."
857,Rinse/Repeat Galaxy,IPA - New England / Hazy,25,7.0,Hazy NEIPA hopped with Galaxy.
858,Pineapple Shake IPA,IPA - Milkshake,25,7.0,"Milkshake IPA brewed with pineapple, vanilla, and milk sugar."
859,Santa Claw,IPA - New England / Hazy,25,7.0,Hazy holiday IPA.
860,Key Lime Pi,Sour - Fruited,5,5.0,"Key Lime Pi is a pastry sour inspired by the ratio of the circumference of the best dessert (key lime pie, obviously) to the diameter of that same pie. To create this delectable dessert delight we started with our base sour beer and employed an extremely advanced, complex brewing technique called ""buying a bunch of key lime pies and putting them into the beer."" Annual release for Pi Day"
861,MAXIMUM FLORIDA,Sour - Fruited,5,6.0,"Super fruited sour with dragonfruit, passionfruit, mango, pineapple, pink guava, key lime, tangerine, toasted coconut, marshmallows, and milk sugar. Lets. Get. Weird"
862,Peanut Butter Shake IPA,IPA - Milkshake,25,7.0,"Milkshake IPA made with lactose, vanilla, and peanut butter."
863,Strawberry Rhubarb Pie Gose,Sour - Fruited Gose,5,4.5,"Gose brewed with strawberry, rhubarb, vanilla, and spices."
864,Tropicália,IPA - American,65,6.6,"Balanced, soft, and juicy. Hopped with Citra, Centennial, and Galaxy."
866,Cosmik Debris,IPA - Imperial / Double,80,8.0,"Cosmik Debris is an 8.0% ABV Double IPA featuring Simcoe, Strata, Mosaic, Cascade, and Chinook hops. Intensely hopped, this Double IPA presents a mind-blowing aroma of citrus zest, melon, and subtle pine"
868,Automatic,Pale Ale - American,60,5.2,American Pale Ale. Mosaic and Crystal hops.
869,Bibo,Pilsner - Other,25,4.9,"Bibo (pronounced bee-bo) is a true pilsner that has a pronounced continental hop flavor and aroma. Hopped with Czech Saaz, US Sterling, and Huell Melon"
870,Reclaimed Rye,Rye Beer,25,5.5,"Reclaimed Rye (5.5%) is a uniquely complex and full-flavored Amber Ale aged on French oak. Our French oak aging process combined with malted and flaked rye delivers a well-rounded body, with notes of toasted bread, spice, and subtle vanilla"
872,Tritonia With Cucumber & Lime,Sour - Fruited Gose,5,4.5,"Tritonia is a 4.5% ABV gently tart fruited Gose brewed with cucumber, lime, sea salt, coriander, and our house blend of lactobacillus. Our take on this classic German-style wheat beer pairs the cool freshness of cucumber with the crisp tartness of lime to create an incredibly refreshing experience"
874,Classic City Lager,Lager - Pale,20,4.2,Good Cold Beer
884,Tritonia With Pineapple & Lemon,Sour - Fruited Gose,5,4.5,Tritonia Gose with pineapple & lemon.
886,See the Stars,Stout - Imperial / Double,90,10.9,Aged for over a year in Willett bourbon barrels previously used to age Mac's Maple syrup for four months.
887,Tropicalisima,IPA - Imperial / Double,80,8.0,"Double IPA riff on Tropicália IPA. Citra, Centennial, and Galaxy hops."
889,Elevated IPA,IPA - American,100,7.2,It’s pretty good. You should try it. Get Elevated!
890,Project Dank,IPA - American,100,7.5,"Project Dank is just that; a project. An ever-changing expression of our hoppiest endeavors, each recipe is different, featuring different hops and hopping techniques. One thing remains common... HOP INSANITY"
891,A Slice of Hefen,Wheat Beer - Hefeweizen,15,5.4,"A traditional take on a Bavarian classic! Poured into a 23 oz. Hefe glass, this beer is served mit hefe with a voluminous white head. The aroma is everything we love in the style; clove, banana and vanilla. The body is rich and creamy, yet finishes fairly dry and is as refreshing as any beer you’ll drink here or anywhere else"
892,Malpais Stout,Stout - Foreign / Export,60,7.5,"This is a meal in a glass. Brewed with 7 different malts and served cask-conditioned, you should be ready for a full onslaught of creamy stout intensity. Broadly in the style of a Foreign Extra Stout, this is our heaviest and most intense year-round offering"
893,Sun Fade,IPA - New England / Hazy,40,6.5,"Lush with bright fruit from the interplay of our house yeast and irresponsible levels of dry-hopping, Sun Fade quenches the dryness of the Southwestern desert like no other beer can"
894,Beer,Lager - Pale,23,4.7,"Too snobby for a good ol’ beer? Looks like beer... Smells like beer... Tastes like beer... it’s BEER. Our aptly named lager is light in body but substantial enough in flavor to let you know that yes.. You are drinking beer.

Yeah BEER"
895,Full Nelson,IPA - Imperial / Double,100,8.7,"To call Nelson Sauvin an aggressive hop would be a vast understatement. What would happen if you made a DIPA that featured this hop??? Over 10 lbs./bbl of hops went into this gem of a DIPA. A ridiculous level of hop aroma, followed by a hop flavor that is literally juicy in texture. The bitterness is undefinable, just unreal. If our Elevated IPA is on the hoppy side of the aisle for you, stay away. If you drink that beer and think to yourself in Homer Simpson’s voice, “That’s kinda hoppy… I guess…” prepare to meet your match. This beer is gonna put the beat down. Will you tap out before you finish the pint"
897,El Jugo,IPA - New England / Hazy,40,6.2,"A post-modern India Pale Ale
Aromas of tropical fruits leap out of the glass of this post-modern IPA; guava, peaches, passionfruit and pineapple are all there. Utilizing a truly unique yeast strain and some of the most fruit forward hops from around the world, this incredibly hazy IPA is huge on aroma with a big creamy-smooth body, finishing soft and clean with a long juicy finish"
898,Acclimated APA,Pale Ale - American,35,5.3,"Elevate, elevate, elevate… It’s what we’ve been doing for 8 years now. We’re really, really good at it. But we’re looking to settle into the warmer months with something just as compelling as our world class IPAs, but less elevating. Acclimated APA. It’s what IPA drinkers drink when they’re not drinking IPA"
899,Strawberry Gose,Sour - Fruited Gose,10,5.0,Lots of strawberry added to a gose
900,Fievre d'Abricot,Farmhouse Ale - Saison,25,8.0,Saison with apricots added at the end of fermentation
902,Father Nelson,IPA - Imperial / Double,100,10.6,"Irresponsible, offensive, repugnant, blasphemous and downright creepy. This is Father Nelson. Father Nelson is a very bad beer. Reaching to the outer expanses of what is possible with hops and alcohol we have created a beer that is literally dripping in hop oils. Don’t be surprised if you see a slick floating in your glass, and not to worry, just hops. Nelson Sauvin gets the starring role in yet another, ridiculously delicious hopgasm from your friends at La Cumbre Brewing Co"
903,La Negra,Stout - Russian Imperial,80,10.5,"Big, black, and beautiful. La Negra is an oak-aged Russian Imperial Stout, brewed with our British Pale malt, and an enormous amount of roasted malts. A 5 hour boil lends a big burnt sugar and raisin character while the intense bitterness gives the beer an incredible dark chocolate finish. Needless to say, the mouthfeel is what you would expect from one of the biggest beers we’ve brewed"
904,Hoplaunch,IPA - American,75,7.5,Nice crisp clean hoppy west coast IPA. Nice job.
905,Pyramid Rock Amber Ale,Red Ale - American Amber / Red,45,5.8,"Going back to our recipes developed in the shadow of the Western NM monolith, this is nothing like your standard American Amber; no American hops to be found in this gem. Lots of earthy, spicy Kent Golding and premium English Crystal malts make this beer unique in a sea of ubiquity"
906,Altimeter,IPA - American,60,6.7,Put a gauge on your lupulin levels with this brightly floral IPA that finishes with a medium light body and a balanced bitterness.
907,Oktoberfest,Festbier,28,5.4,Bavarian style lager. Oktoberfest
908,Ryeot IPA,IPA - Rye,75,6.5,"A malted magic hop bomb. Balanced, but abrasive, our rye India Pale Ale marries intense hop aroma with the spiciness of the finest malted Rye under a rich caramel and toasted malt backdrop"
909,Gilded Age Porter,Porter - American,35,5.7,"Harkening back to a time when pale malts had not yet been created, our deep black Porter is rich but balanced, intensely chocolatey but not burnt"
910,Project Dank Winter Edition,IPA - Imperial / Double,100,7.5,Healthy amounts of hops. Kinda fruity and spicy.
911,South Peak Pilsner,Pilsner - Other,45,5.3,"Are you craving something a little more rustic? Our pilsner will get you there. Loads of Czech and German hops, the finest quality Continental pilsnet malt, and uber-traditional production methods are the hallmarks of this glorious lager"
913,Wet Hopped Elevated IPA,IPA - American,100,7.2,"I can hear the jinglers now… “It’s the most wonderful time of the year!” The hop harvest is a very special time for the craft brewing industry. For many of us, not only does it mean new opportunities with this next harvest’s finest hops, it also means wet hops, fresh off the bine. Early in the morning of Saturday, August 26th, several farmhands stayed up and harvested Chinook for us in Southern Colorado which would then be driven down for the sole purpose of making this very special batch of the IPA that put Albuquerque on the proverbial craft beer map. Rich with the fresh green aromas that only wet hops can bring, this is everything you love about Elevated IPA, and then some"
914,Furious,IPA - American,100,6.7,"The beer that built Surly. Aggressively hopped and citrusy, but with a chewy, caramel malt backbone."
915,Axe Man,IPA - American,65,7.2,"Double dry-hopping with Citra and Mosaic hops creates this world-renowned IPA’s intense tropical fruit and citrus aromas. Brewed with Golden Promise malt, this beer finishes rich and dry. First brewed in collaboration with Amager Brewery in Denmark"
916,Abrasive Double IPA,IPA - Imperial / Double,100,9.2,"A massive dose of Citra hops launch our legendary double IPA (Minnesota’s first, and a nod to our abrasives factory origin) into the hophead stratosphere"
919,Hell,Lager - Helles,20,5.0,"Hell is German for ""light."" A pale gold lager with bready malt aromas and flavors, floral hop aroma, and a balanced finish."
920,OverRated,IPA - American,69,7.3,"It’s been said, “It’s easier to brew an extremely hoppy beer than an extremely balanced beer.” And you know us, we are always looking for the easy way out, so we jumped on the West Coast IPA Bandwagon and brewed this dry and hoppy ale. “Surly’s a little bit of a one-trick pony, they just brew gimmick beers,” and maybe we are OVERRATED, but at the end of the day, it’s just a beer. If you like it, great, so do we. If you only liked us when we were small, then leave this one on the shelf. Let one of the fanboys grab it"
921,Bender,Brown Ale - American,25,5.1,"This beer is an amalgamation of styles; brown/porter/APA. Five distinct malts, including two from Belgium, give this beer added complexity and depth. We also add oatmeal to this beer to give it a smooth texture not usually associated with this type of beer. We add large amounts of American finishing hops to give Bender a citrus hop aroma because... we like hops. This is a session beer weighing in around 5% alcohol and 25 IBUs. Grab one today, we think you will want another"
922,Cynic,Farmhouse Ale - Saison,33,6.5,"Oh great, a fizzy yellow beer in a can, that's just what the craft beer world needs! CynicAle melds Old World ingredients in a new school style. French malted barley, English oats and Belgian yeast create honey & black pepper flavors. Lively Slovenian hops provide the floral, apricot and peach notes. Toss your doubts away, toss one back and enjoy"
