,Name,style,IBU,ABV,Description
670,Greenstone,Pale Ale - New England / Hazy,40,5.5,This lighter entry into the New Orthodox Series features a hint of pepper and earth from rye in the grain bill as well as citrus and stone fruit flavors and aroma from the all Michigan hops
671,Electron Brown,Brown Ale - Imperial / Double,40,8.1,"Named in memory of Ron Brown, our dearly missed engineer/ general problem solver here at Old Nation.

This aggressive Double Brown ale is fresh ground coffee beans for a huge espresso aroma and flavor. Lightly sweet"
672,DDH M-43,IPA - New England / Hazy,65,6.8,Double dry-hopped NE IPA.
673,ME-MI Triple NEIPA,IPA - Triple New England / Hazy,50,10.3,"Our collaboration with our friends at Foundation Brewing in Maine! No pineapples were harmed in the making of this beer. Pilsner, Oats, and Rice lay the base down for the Michigan Chinook, Michigan Crystal, and Citra hops to run wild. You're going to have to look real hard to find the 10.3% ABV"
674,70+,IPA - American,72,6.8,"With the introduction of 70+ West Coast IPA (ABV 6.8%), Old Nation brings a classic, straight down the middle pilsner malt bill with a more classic aggressive 72 IBU providing the traditional bitter balance of the style. Using a combination of Columbus and Simcoe hops for their pine/resiny notes along with Amarillo for citrus and floral notes, Old Nation’s brewers added the proprietary Idaho 7 for a new-school tropical twist"
680,Shandy,Shandy / Radler,7,4.8,"Old Nation Shandy is a combination of our classic Helles Lager and lemonade from Guernsey Farms. Our companies teamed up to make a refreshing, simple and true to style summer lager"
681,Helles Lager,Lager - Helles,18,5.5,"Soft, subtle, and so clean you can taste the field the barley grew in. Less is more in these lagers, and balance is the goal. The yeast, time, and talent we put into our Helles produce light notes of honey and soft herbal hops with just a hint of bitterness.

Subtlety can't be faked, which is why this is one of our favorite styles to make"
682,Dry Honey Saison - Woodshed Pilot Series,Farmhouse Ale - Saison,20,7.1,"French style summer ale with spicy phenols from the yeast and a dry, honey finish."
683,Sanders Chocolate Stout,Stout - Milk / Sweet,13,4.8,"Chocolate meets beer. Need we say more? Collaboration beer with Sanders Chocolate Company from Detroit, MI."
686,The German Hobo,Malt Liquor,58,11.9,"There's good evidence that Malt Liquor, based in the German Lager tradition, was first made in Ionia, MI around 1937. The German and American trained brewers at Dark Horse and Old Nation are old friends and wanted to collaborate to put a craft spin on this old, Michigan born style. Top quality Pilsner and Vienna malt, along with noble German hops in the boil make The German Hobo a very balanced beer; and the subtle addition of noble German Dry hops after fermentation make for a true craft experiment"
687,Pret Wit,Wheat Beer - Witbier / Blanche,18,5.5,"Pret Wit has a strong backbone of wheat and oat malts, which give body and fullness to the light citrus notes of coriander and bitter orange peel. The faint citrus presence on the finish along with a slight acidity cleanses the palate and belies the relatively substantial body of the beer. Notes of chamomile and very slight herbal hops add color to the light, ephemeral nature of Pret Wit.

The determination to create the perfect witbier included sourcing premium ingredients, such as the perfect oat malt to pair with carefully selected bitter orange peel and coriander ground the day the beer is brewed versus powdered"
689,Bomb!,Stout - Imperial / Double Coffee,65,13.0,"Bomb! is an imperial stout aged on Nordaggio's espresso beans, chocolate, vanilla beans, and ancho chile peppers. All the flavors meld to create a truly unique beer. The peppers add just the right amount of heat to complement the intense coffee and chocolate flavors"
690,Christmas Bomb!,Stout - Imperial / Double,65,13.0,"The Bomb! that we all know and love, with the addition of Christmas spices – cinnamon, ginger, and nutmeg."
692,Birthday Bomb!,Stout - Imperial / Double,65,13.0,"Imperial stout aged on coffee, cacao nibs, vanilla beans and chile peppers. Finished with caramel sauce."
693,Phantasmagoria,IPA - Imperial / Double,70,8.0,"Phantasmagoria is an IPA that is low in malt flavors, but high in hops. We brew this beer as a nod to the big hoppy beers of the west coast. We use loads of citrusy and piney hops at the end of the boil and in the fermenter to make this beer a hop experience"
694,Standard,Farmhouse Ale - Saison,25,5.6,"Prairie Standard is our everyday beer. Its a light, crisp saison with a hoppy finish. This beer is dry hopped 1lb per bbl with Motueka hops. A lovely New Zealand hop with a spicy lime like flavor and aroma"
697,Funky Gold Mosaic,Sour - Other,18,5.8,Dry hopped sour ale.
699,Apple Brandy Barrel Noir,Stout - Imperial / Double Oatmeal,70,12.0,Apple Brandy Barrel aged Noir
700,Pirate Bomb!,Stout - Imperial / Double,65,15.0,"Aged in rum barrels w/ coffee, cacao nibs, vanilla beans and chilies added."
701,Vanilla Noir,Stout - Imperial / Double Oatmeal,60,13.7,"Vanilla Noir is Prairie Noir aged on organic, fair trade vanilla beans, and let’s just say it takes a lot of beans! The vanilla flavor compliments the whiskey barrel aging process and adds a delicious layer to the beer"
704,Birra Farmhouse Ale,Farmhouse Ale - Saison,18,4.5,"Birra is a light, sessionable farmhouse ale. It is crisp with notes of black pepper and orange and goes perfectly with food."
707,Prairie Hop,Farmhouse Ale - Saison,40,8.0,"Prairie Hop is our hop driven saison. This beer is packed with Simcoe and Citra hops. Notes of peach, mango, and tangerine can be found in the flavor and aroma of this beer. The beer finishes dry which helps the hops jump out of the glass flavor wise"
708,Pe-Kan,Stout - Imperial / Double,60,11.5,Imperial Stout brewed with copious amounts of vanilla & pecans.
709,Bourbon Paradise,Stout - Imperial / Double,9,15.9,Imperial Stout Aged in Bourbon Barrels with Coconut and Vanilla
710,'Merica,Farmhouse Ale - Saison,30,7.5,"‘Merica is a single malt, single hop farmhouse ale. It’s brewed with floor malted pilsner and 3lbs per bbl Nelson Sauvin hops. The beer is conditioned with 2 brett strains and wine yeast. The Nelson hops provide white wine flavors while Brettanomyces add a juicy quality to the beer"
711,Pink Guava Funk,Sour - Fruited,30,6.3,Kettle Sour with Brett and Pink Guava
712,Pirate Noir,Stout - Imperial / Double Oatmeal,60,12.0,A big Imperial Stout aged in Jamaican Rum barrels.
713,Consider Yourself Hugged,Stout - Imperial / Double Coffee,50,11.9,Imperial Stout with Peanut Butter Roasted Coffee.
714,Fiddlehead IPA,IPA - American,53,6.2,"Our flagship IPA, A hop forward American IPA with mellow bitterness. Citrusy and Dank. Well Balanced."
715,Second Fiddle,IPA - Imperial / Double,80,8.2,"Extensively dry-hopped double IPA. Second Fiddle is second in name only. It’s big, juicy and aromatic. Citrus, Tropical, Pine"
716,Mastermind,IPA - Imperial / Double,90,8.1,"American Double IPA with tropical fruit notes. Straw colored with a hazy glow. Pineapple and Cantaloupe are dominant characteristics. This beer finishes with a slight tartness.

25% of sales from Mastermind Double IPA are contributed to the Team Mastermind Fund which provides charitable grants to organizations that support pediatric health and broad community wellness"
717,Hodad,Porter - Other,30,5.5,"Porter brewed with house toasted coconut flakes, cacao nibs, vanilla bean and lactose."
718,Rarefied Air,Pale Ale - American,35,5.0,"Refreshing, Lightly Tart and Hazy Hoppy Pale Ale with Bright Citrus Notes and an Herbal Bitterness."
719,Tejas Marrón,Brown Ale - Imperial / Double,75,8.0,"Citrus, chocolate & burnt sugar notes meld together in this big, hoppy brown ale brewed with brown sugar."
720,Brett On The Dancefloor,Wild Ale - American,45,5.1,100% Brettanomyces Fermented
722,Golden Grillz,Golden Ale,25,5.2,"Brewed with a pilsner malt base, our American Golden Ale is light and crisp featuring earthy and herbal notes."
723,New New Rarified Air,Pale Ale - American,50,5.0,Hop forward American style pale ale brewed with oats
727,Cowboy Neal,IPA - Imperial / Double,70,8.1,American Double Wheat India Pale Ale
739,Sea Hag IPA,IPA - American,65,6.2,"A ghostly apparition reportedly skirts the shores of New Haven harbor; a whispy widow eternally searching for her lost-at-sea husband. It is truly a sad tale of loss. But hey! At least she's got a beer named after her, huh? Our flagship beer pours in with a citrus, fruity nose and a crisp floral finish that is well balanced with it's Pilsner, Munich, and Crystal malt blend"
740,G-Bot,IPA - Imperial / Double,85,8.8,"The beer. The 'Bot. The legend. This sought-after Double IPA packs in a whole mess of hops in order to churn out a bombastic citrus taste full of orange peel, mildly dank whiffs of pine, and a deceptively easy-flowing flavor. There's just enough haze in this one to satisfy the ""Hops Heads"" while it's not to bitter/crazy for first-timers to enjoy this fruity brew"
741,Fuzzy Baby Ducks,IPA - New England / Hazy,60,6.2,"Yup... we're the ones who make this. A member of our single hopped beer club, this IPA is both brewed and dry hopped with nothing but Citra hops... that's it... all Citra, all day. And that's what gives you the big, mango, papaya, and citrus taste that makes tongues celebrate and lines of beer fans form up just to sample this beauty"
742,Coriolis,IPA - Imperial / Double,80,8.2,"One of our ""single hopped"" beers, this Double IPA gets brewed with only the Nelson Sauvin hop grown solely in New Zealand. A bright-tasting beer that has a big, ole taste of white grape. And yes, the label image is of a Hobbit holding a hop vine while being eaten by a T-Rex. It just seemed... there was this... um, honestly, we don't know what that's all about"
743,668 The Neighbor of the Beast,Belgian Strong Golden Ale,30,7.8,"The La Chouffe Belgian yeast used in this brew leaves your taste buds wondering what's up. A ""gateway beer"" that is a fine first step into Belgian brews, The Neighbor Of The Beast is a fruity, banana-tinged, spicy little number that is full-flavored without being overwhelming... and it is oddly a great pairing with caramel-covered popcorn. Yeah! We know! Right? Go figure"
744,Supernaut IPA,IPA - American,65,5.8,"If there were an astronaut that was exceptional, they would be quite super, correct? Perhaps even a ""Supernaut"", yes? Maybe even find inspiration in an old, Balek Sabbath song? Sure. And this is a pretty super tasting beer with rich, full passion fruit, pineapple and mixed berry flavor. This all Mosaic hop favorite pops up throughout the year and fits well into any season"
745,Double Fuzzy Baby Ducks,IPA - Imperial / Double New England / Hazy,80,8.2,"Bigger is better, right? We figured we'd put that adage to the test. So, we decided to take our FBD IPA and make an ""Imperial"" version of it and that's just what we did. Double Fuzzy is a bit stronger, a bit heavier on the tropical fruit flavors"" and hopefully even more pallet-pleasing. Grabbing two is appropriate"
746,Imperial Stout Trooper,Stout - Imperial / Double,40,9.5,"Nearly a dozen types of malts and grains go into this FORCE-full, American Imperial Stout. Hints of coffee, tastes of dark fruit, and a subtle chocolate background make this Stout the perfect brew to welcome the Winter months. Brewed solely during the onset of the colder months, this one-time-a-year release will make you come over to the dark side... of beer"
747,Locust Reign,IPA - Imperial / Double,82,8.2,"This is a monster of a Double. Big, hearty, and it's got girth. Huge tropical fruit taste and aroma converge in this beer with an abundance of Galaxy hops in the blend. Easy smooth drinking for an 8.2% beer. And no flying bugs"
748,Galaxy Pale Ale,Pale Ale - American,45,4.8,"Why look. It's another member of our single-hopped beer collective. This beer is a classic, lower alcohol, American Pale Ale brewed with nothing but Galaxy hops from Australia. That gives the taster a mouthful of pineapple, guava, and other tropical flavors to enjoy while trying to figure out how we named this one. It's okay. We'll wait"
749,Ghost Pigeon Porter,Porter - American,40,5.8,"The cooler, Autumn months are welcomed with this American style Porter brewed up with seven kinds of malt. Dark, chocolate-y, roast-y, with a graham cracker finish, this ""sweater weather"" Porter gets it's name from the wispy coo's of a specter pigeon that haunted our first location. This beer is frighteningly good"
750,Elm City Pilsner,Pilsner - German,40,5.0,"A craft brewed version of a traditional German style pilsner that we brew with all german malt and noble hops. Clean, Dry & Hoppy!"
751,Dose DIPA,IPA - Imperial / Double,85,8.2,"Drop this fruit bomb on your tongue and enjoy the explosive tropical vacation tastes! No, seriously. Dose is trip-tastic journey into DIPA-vile and you are the sole traveler. Guava, passion fruit, papaya, and citrus swirls guide you through a pint of this. Whoa, man. I'm tracing"
752,Kewl Beans,Stout - Oatmeal,25,6.0,"The flaked oats added to the eight malts and grains in this brew add a creamy, near sweetness that cuts the sharpness of the coffee without eliminating the rich, robust flavor. A blend of Ethiopian and Costa Rican coffees from our amigos/amigas at One World Roasters give you that ""morning cup"" flavor in an easy-going pint of beer"
753,The Ocho IPA,IPA - American,65,6.8,"This IPA has all of the Ekunot hops right up front, banging from the first sip. Ekunot is a newly created hop that has lots of pine, dark fruit, and a handful of citrus tastes all rolled into one hop. A crackin' good beer that lived previously as ""# 8"" in our old, in-house, Fat Ten-er series"
754,Coffee Breath,Stout - Imperial / Double Milk,30,8.4,"This Imperial Coffee Oat Milk Stout is dang huge in name, taste, as well as ingredients. There's five different roasts of malt in here along with a smattering of roasted barley, a goodly bunch of oats, a pinch of lactose sugar for a rich and creamy mouth feel, and big ole heaping brew of Dominican and Sumatran coffee from our java pals over at One World Roasters. Imagine a fudgey chocolate brownie dipped in a smooth, locally roasted cup of joe"
755,Weiss Trash Culture,Sour - Berliner Weisse,8,3.4,"A not-often seen style here, our take a traditional Berliner Weiss (or ""wheat"") sports a clean, tightly sour taste that is achieved by using a Lactobacillus culture in the brewing process. Not overbearing and with a sharp, lemon taste, this beer can quench a thirst any time of year but is really the ultimate in hot, Summertime drinks. That's why we only release it during lawn mowing season"
757,Gold Stock Ale,Golden Ale,55,6.5,"A truly unique beer here. A German style pale ale brewed up during colder months with Noble hops and some American hops tossed in for good measure. But hold on, Bub. The resulting grassy/earth-y notes that blend well with the citrus/lemon flavors are then married further by letting the whole deal ferment on lightly toasted oak chips for an amazing, individual taste"
758,Motueka Ma-uke,Pale Ale - American,55,5.3,"This American-styled Pale uses an abundance of the Motueka (Moe-Too-A-Kah) hops from New Zealand which gives it an earthy/grassy hint mixed with a heavy lime sense. Crisp, refreshing, easy-going. The name requires a Masters Degree to explain so, we'll just leave that alone"
759,Scrumtrulescent,Farmhouse Ale - Saison,30,5.6,"Styled after the Saisons that are prevalent in the farmhouses of the Belgian countryside, this spunky and slightly fruity, little dandy has a hint of pepper in the mouth. Toss a pinch of lemon zest in there and you've got a light and airy number that screams, ""fabulous!"
760,Schnitzengiggles,Festbier,20,5.6,"A German style festbier brewed for the Octoberfest season. A clean refreshing malty flavorbuilt around toasted bread, soft sweetness and a light hop characte"
762,Attack of Duckzilla - Triple Fuzzy,IPA - Triple New England / Hazy,60,10.5,"This monster of an IPA leaves you wondering why you feel so warm and Fuzzy...oh yeah, it's 10.5%. Big notes of ripe citrus and mango bombard your face with a smooth and sneaky finish"
763,Stegosaurus,IPA - Imperial / Double,45,8.2,"Introducing Stegosaurus! Our latest and greatest DIPA and a radical lizard from the late Jurassic period, this bad boy is 8.2% dry hopped with Citra, Mosaic and Azacca. Think super smooth with huge tropical fruit notes"
764,Lush IPA,IPA - American,80,7.0,"We bring this tropical treat to you as a reminder of Spring’s coming, its rebirth and promise of sunny days forever. Lush is made with a hand-selected blend of malts and lush, tropical hops to help you bridge the last days of Winter and the coming of the Spring fever. We hope you enjoy this tropical treat, keep your sunglasses handy, and wash away your cares in the coming Spring rains"
765,Interurban IPA,IPA - American,80,6.2,"Named after Fremont’s most famous outdoor sculpture, Waiting for the Interurban, Interurban India Pale Ale offers the adventurous beer lover a warm embrace of roasted pale malt swirled with a hand-selected blend of flavor malts and filled with the rich spice of Chinook, Centennial and Amarillo hops. Interurban India Pale is a session beer, eminently drinkable throughout the year"
766,Dark Star,Stout - Imperial / Double Oatmeal,50,8.0,"Roasty, chocolate tones swirled with oatmeal smoothness and dark as the night. The Dark Star crashes, pouring its light into ashes, so follow as the Lady of Velvet recedes in the nights of goodbye. This one is too smooth … and at 8.0% ABV, dangerous"
767,Summer Ale,Pale Ale - American,45,5.2,"Previously known as Solstice Ale. Tangerine flower in a glass, endless days distilled into nectar of barley and hops. One grain, one hop. Simplicity... yet, so much more"
769,Head Full of Dynomite,IPA - New England / Hazy,85,6.8,"Head Full of Dynomite (HFOD) is an ongoing series of hazy IPAs, each one different from the one before.
“Friends bring happiness into your life, best friends bring beer.” – VW"
770,Universale Pale,Pale Ale - American,35,5.6,"Fremont is the self-proclaimed “Center of the Universe” and Universale, our flagship product, honors the namesake of our unique location. Universale Pale Ale offers a distinctive Northwest twist on the classic pale ale, using a select blend of pale roasted malt and Old World malts balanced with classic Northwest hops to achieve a heavenly beer of rich malt flavor and hop spice. This is beer. Enjoy"
771,The Brother Imperial IPA,IPA - Imperial / Double,100,8.5,"The Brother is a beast. Brewed with twice as much barley and 1/2 pound of hops per keg, the Brother will sit on your palette and beat you down. And you’ll like it. This ain't no toy, Boys 'n' Girls. This is a Northwest Imperial IPA. Hops First, Hops Last and Hops All The Way Through"
772,The Sister Imperial IPA,IPA - Imperial / Double,80,8.5,"Family always comes first. Just when you thought that your poor tongue couldn't stand any more humulus lupulus, The Sister comes home to prove you wrong. Using the same unbreakable malt backbone of The Brother to balance out a truckload of Calypso and Bravo hops, The Sister weighs in at approximately a billion IBUs"
773,Bonfire Ale,Brown Ale - American,40,6.0,"Bonfire Ale steals from the winter fires its gift of dark barley and gentle hops to provide you, beer drinker, with this delightful winter treat. Fremont set the sky rockets to flight and wrote the book on afternoon delight before waking the night on the wings of a great blue heron to soar below the radar and above the clouds, raining down beer to blow your mind and caress your soul. Light a Bonfire today.

Down & Dirty: 2-Row & White Wheat, Midnight Wheat, Rye, Smoked, & Chocolate Malts with Cascade and Goldings hops"
774,Cowiche Canyon Fresh Hop Ale,Pale Ale - American,50,6.0,"Cowiche Canyon Fresh Hop Ale is brewed from select organic hops grown in the Cowiche Canyon of the Yakima Valley which are harvested and placed into our kettle within 24 hours, creating a unique, once-a-year beer. We make Cowiche Canyon ale in partnership with hop-growing wizards from the Yakima Valley in an effort to expand the organic hop industry in Washington State… Because Organic Hops Matter. A portion of all sales fund the Cowiche Canyon Conservancy"
776,The Rusty Nail,Stout - Imperial / Double Oatmeal,50,13.2,"The Rusty Nail begins life as The First Nail, an oatmeal stout of epic proportions with brewer’s licorice, smoked barley, and pale malt and aged on cinnamon bark. She becomes the Rusty Nail after spending 15 months in 12-year old bourbon barrels. The Rusty Nail pounds your palate, challenges your perception of all that you’ve known of beer, and leaves you wanting…another sip"
777,Mod Pod,IPA - American,60,7.0,"TROPICAL FRUIT, CANDIED ORANGE, TANGERINE, AND AN ECHO OF MALT SWEETNESS

Mod Pod IPA honors our three pods of Southern Resident Orca whales living full-time in the Puget Sound, the J, K, and L Pods.
Currently numbering 78 whales, our whales are a treasure worthy of reflection and thought. In particular, we think of Granny (J-2) who was the leader of the J, K, and L Pods and is considered to have been the oldest orca in the world when she died in 2016 after 107 years of gracing our waters. Granny was the Matriarch of the Southern Resident Community, and we brew Mod Pod IPA in her honor. Enjoy and observe"
778,Session Pale Ale,IPA - Session,50,4.5,This session and is made with Citra and Simcoe hops grown in Washington's Yakima Valley which will enlighten your mind and make you a smarter and better looking person... Because Beer Matters
779,Space Danger!,IPA - American,61,7.0,"2-Row Pale malt, Rolled Oats, and White Wheat with Simcoe, Sabro, and Centennial hops make the base for Space Danger! IPA."
780,Golden Pilsner,Pilsner - Czech,20,4.5,"Bohemian Pilsner Malt, White Wheat, and Acidulated Malt with Czech Saaz hops make up the classic Czech-style lager Golden Pilsner."
781,Field to Ferment Fresh Hop Pale,Pale Ale - American,50,6.0,Fresh Hop Pale Ale
782,77 Fremont Select,IPA - Session,60,4.0,"A crisp and refreshing spring wunderbeer, 77 Select is Fire Brewed in the pits of Fremont Brewing to achieve its rarefied Session IPA status. With this brew we respect Seattle's old Horlucks & Sicks Brewing Companies, predecessors of Rainier Brewing, and their flagship beers 66 Select and Rainier. ""Alcohol may not solve your provlems, but neither will water or milk."" – VW"
784,Winter Ale,Winter Ale,47,8.0,"This is a tasty Winter Ale to snuggle up to, released for the winter months when snow blankets the terrain of the mind and the body craves warmth and, let’s be honest, it’s dark and wet most of the time so your beer better be damn good. Winter Ale is dark like the weather with roast chocolate and warm malt flavors balanced by Noble hop aroma and subtle hoppy spice. Warm up to it. Because Beer Matters"
785,Mountain Daisy,IPA - American,65,7.0,"Spring is the season of Renewal and Invention, and that’s cool with Fremont, so we decided to offer not one, but three different beers for our Spring Seasonal this year. The February beer is Mountain Daisy IPA. We brew this beer with an eye towards the return of the flowers to the mountains as the snow begins to melt and the eternal power of Spring flexes her muscles. “Before you criticize someone, you should walk a mile in their shoes. That way when you criticize them, you are a mile away from them, and you have their shoes.” – Jack Handy

Down & Dirty: 2-Row Pale and Vienna malts with Rolled Oats and Columbus, Simcoe, Centennial, and Citra hops.
ABV: 7.0%
IBU: 6"
786,Brew 5000 (2021),Barleywine - English,30,12.2,"English-Style Barleywine Ale aged in Bourbon Barrels

Fremont Brewing began as a dream in 2008. Years later, our dream has come true in each and every one of you, our craft beer family. And like every family, we have had our ups and our downs, but we keep coming back together knowing we are stronger together. In your hands is a special nod to you, a gift for now that will continue to give many years from now should you have the patience to wait…Brew 5000. This English-style barleywine ale uses floor-malted English barley, Noble hops, and is aged in 10-15 year-old, single use bourbon barrels for 16 months to bring you a complex and subtle craft beer flavor experience. We brewed this to celebrate brewing our 5000th brew, and we look forward to sharing it with you, our craft beer family. “Barleywine Is Life."" – You

Down & Dirty: Maris Otter Pale and Carafa 2 Special malts, White Wheat, with Magnum and US Goldings hops.

Color: Dark brown
Aroma: Brown sugar, vanilla, caramel, toffee and other sweet aromatics, with dried fruit and some stone fruit notes. Whiskey and oak linger in the background
Flavor: High sweetness, slightly bitter and definite lingering sweetness in a medium body with alcohol warmth and mouthwaterin"
788,Kentucky Dark Star,Stout - Imperial / Double Oatmeal,50,13.1,Our Imperial Oatmeal Stout aged in 15 year old single use Kentucky Bourbon Barrels. The roasted and chocolate malts compliment the smooth oats to bring you a stout delight wrapped in gentle embrace of Bourbon Barrel aged warmth. A touch of sweetness dances in balance with the hops to finish with a wave and then she’s gone
